[
  {
    "id": "linear_loop_cpp",
    "name": "Linear loop (C++)",
    "language": "cpp",
    "code": "void solve(int n) {\n    for (int i = 0; i < n; i++) {\n        a[i] = i;\n    }\n}",
    "expected_tc": "O(n)",
    "expected_sc": "O(1)",
    "expected_algorithms": [],
    "tags": [
      "loop",
      "linear"
    ]
  },
  {
    "id": "linear_loop_java",
    "name": "Linear loop (Java)",
    "language": "java",
    "code": "class Solution {\n    public void solve(int n, int[] a) {\n        for (int i = 0; i < n; i++) {\n            a[i] = i;\n        }\n    }\n}",
    "expected_tc": "O(n)",
    "expected_sc": "O(1)",
    "expected_algorithms": [],
    "tags": [
      "loop",
      "linear"
    ]
  },
  {
    "id": "nested_quadratic_cpp",
    "name": "Nested quadratic loops (C++)",
    "language": "cpp",
    "code": "long long solve(int n) {\n    long long sum = 0;\n    for (int i = 0; i < n; i++) {\n        for (int j = 0; j < n; j++) {\n            sum += i * j;\n        }\n    }\n    return sum;\n}",
    "expected_tc": "O(n^2)",
    "expected_sc": "O(1)",
    "expected_algorithms": [],
    "tags": [
      "loop",
      "nested"
    ]
  },
  {
    "id": "nested_quadratic_java",
    "name": "Nested quadratic loops (Java)",
    "language": "java",
    "code": "class Solution {\n    public long solve(int n) {\n        long sum = 0;\n        for (int i = 0; i < n; i++) {\n            for (int j = 0; j < n; j++) {\n                sum += (long) i * j;\n            }\n        }\n        return sum;\n    }\n}",
    "expected_tc": "O(n^2)",
    "expected_sc": "O(1)",
    "expected_algorithms": [],
    "tags": [
      "loop",
      "nested"
    ]
  },
  {
    "id": "nested_dependent_cpp",
    "name": "Nested dependent loops (C++)",
    "language": "cpp",
    "code": "long long solve(int n) {\n    long long cnt = 0;\n    for (int i = 0; i < n; i++) {\n        for (int j = 0; j < i; j++) {\n            cnt++;\n        }\n    }\n    return cnt;\n}",
    "expected_tc": "O(n^2)",
    "expected_sc": "O(1)",
    "expected_algorithms": [],
    "tags": [
      "loop",
      "nested"
    ]
  },
  {
    "id": "nested_dependent_java",
    "name": "Nested dependent loops (Java)",
    "language": "java",
    "code": "class Solution {\n    public long solve(int n) {\n        long cnt = 0;\n        for (int i = 0; i < n; i++) {\n            for (int j = 0; j < i; j++) {\n                cnt++;\n            }\n        }\n        return cnt;\n    }\n}",
    "expected_tc": "O(n^2)",
    "expected_sc": "O(1)",
    "expected_algorithms": [],
    "tags": [
      "loop",
      "nested"
    ]
  },
  {
    "id": "sequential_loops_cpp",
    "name": "Sequential loops (C++)",
    "language": "cpp",
    "code": "void solve(int n, int m) {\n    long long a = 0, b = 0;\n    for (int i = 0; i < n; i++) a++;\n    for (int j = 0; j < m; j++) b++;\n}",
    "expected_tc": "O(n + m)",
    "expected_sc": "O(1)",
    "expected_algorithms": [],
    "tags": [
      "loop",
      "sequential"
    ]
  },
  {
    "id": "sequential_loops_java",
    "name": "Sequential loops (Java)",
    "language": "java",
    "code": "class Solution {\n    public void solve(int n, int m) {\n        long a = 0, b = 0;\n        for (int i = 0; i < n; i++) a++;\n        for (int j = 0; j < m; j++) b++;\n    }\n}",
    "expected_tc": "O(n + m)",
    "expected_sc": "O(1)",
    "expected_algorithms": [],
    "tags": [
      "loop",
      "sequential"
    ]
  },
  {
    "id": "geometric_mult_cpp",
    "name": "Geometric multiplication step (C++)",
    "language": "cpp",
    "code": "long long solve(int n) {\n    long long cnt = 0;\n    for (int i = 1; i <= n; i *= 2) {\n        cnt++;\n    }\n    return cnt;\n}",
    "expected_tc": "O(log n)",
    "expected_sc": "O(1)",
    "expected_algorithms": [],
    "tags": [
      "loop",
      "geometric"
    ]
  },
  {
    "id": "geometric_mult_java",
    "name": "Geometric multiplication step (Java)",
    "language": "java",
    "code": "class Solution {\n    public long solve(int n) {\n        long cnt = 0;\n        for (int i = 1; i <= n; i *= 2) {\n            cnt++;\n        }\n        return cnt;\n    }\n}",
    "expected_tc": "O(log n)",
    "expected_sc": "O(1)",
    "expected_algorithms": [],
    "tags": [
      "loop",
      "geometric"
    ]
  },
  {
    "id": "halving_div_cpp",
    "name": "Halving division step (C++)",
    "language": "cpp",
    "code": "long long solve(int n) {\n    long long cnt = 0;\n    for (int i = n; i > 0; i /= 2) {\n        cnt++;\n    }\n    return cnt;\n}",
    "expected_tc": "O(log n)",
    "expected_sc": "O(1)",
    "expected_algorithms": [],
    "tags": [
      "loop",
      "halving"
    ]
  },
  {
    "id": "halving_div_java",
    "name": "Halving division step (Java)",
    "language": "java",
    "code": "class Solution {\n    public long solve(int n) {\n        long cnt = 0;\n        for (int i = n; i > 0; i /= 2) {\n            cnt++;\n        }\n        return cnt;\n    }\n}",
    "expected_tc": "O(log n)",
    "expected_sc": "O(1)",
    "expected_algorithms": [],
    "tags": [
      "loop",
      "halving"
    ]
  },
  {
    "id": "two_pointers_cpp",
    "name": "Two pointers pair sum (C++)",
    "language": "cpp",
    "code": "bool hasPair(const vector<int>& a, int target) {\n    int n = a.size();\n    int l = 0, r = n - 1;\n    while (l < r) {\n        int sum = a[l] + a[r];\n        if (sum == target) return true;\n        if (sum < target) l++;\n        else r--;\n    }\n    return false;\n}",
    "expected_tc": "O(n)",
    "expected_sc": "O(1)",
    "expected_algorithms": [
      "Two Pointers"
    ],
    "tags": [
      "two_pointers"
    ]
  },
  {
    "id": "two_pointers_java",
    "name": "Two pointers pair sum (Java)",
    "language": "java",
    "code": "class Solution {\n    public boolean hasPair(int[] a, int target) {\n        int n = a.length;\n        int l = 0, r = n - 1;\n        while (l < r) {\n            int sum = a[l] + a[r];\n            if (sum == target) return true;\n            if (sum < target) l++;\n            else r--;\n        }\n        return false;\n    }\n}",
    "expected_tc": "O(n)",
    "expected_sc": "O(1)",
    "expected_algorithms": [
      "Two Pointers"
    ],
    "tags": [
      "two_pointers"
    ]
  },
  {
    "id": "lowbit_fenwick_cpp",
    "name": "Lowbit subtraction loop (C++)",
    "language": "cpp",
    "code": "long long query(int x, const vector<long long>& bit) {\n    long long sum = 0;\n    while (x > 0) {\n        sum += bit[x];\n        x -= x & -x;\n    }\n    return sum;\n}",
    "expected_tc": "O(log n)",
    "expected_sc": "O(1)",
    "expected_algorithms": [],
    "tags": [
      "lowbit"
    ]
  },
  {
    "id": "lowbit_fenwick_java",
    "name": "Lowbit subtraction loop (Java)",
    "language": "java",
    "code": "class Solution {\n    public long query(int x, long[] bit) {\n        long sum = 0;\n        while (x > 0) {\n            sum += bit[x];\n            x -= x & -x;\n        }\n        return sum;\n    }\n}",
    "expected_tc": "O(log n)",
    "expected_sc": "O(1)",
    "expected_algorithms": [],
    "tags": [
      "lowbit"
    ]
  },
  {
    "id": "simple_recursion_cpp",
    "name": "Simple linear recursion (C++)",
    "language": "cpp",
    "code": "long long factorial(int n) {\n    if (n <= 1) return 1;\n    return n * factorial(n - 1);\n}",
    "expected_tc": "O(n)",
    "expected_sc": "O(n)",
    "expected_algorithms": [],
    "tags": [
      "recursion"
    ]
  },
  {
    "id": "simple_recursion_java",
    "name": "Simple linear recursion (Java)",
    "language": "java",
    "code": "class Solution {\n    public long factorial(int n) {\n        if (n <= 1) return 1;\n        return (long) n * factorial(n - 1);\n    }\n}",
    "expected_tc": "O(n)",
    "expected_sc": "O(n)",
    "expected_algorithms": [],
    "tags": [
      "recursion"
    ]
  },
  {
    "id": "sieve_cpp",
    "name": "Sieve of Eratosthenes (C++)",
    "language": "cpp",
    "code": "void sieve(int n) {\n    vector<bool> is_prime(n + 1, true);\n    is_prime[0] = is_prime[1] = false;\n    for (int p = 2; p * p <= n; p++) {\n        if (is_prime[p]) {\n            for (int i = p * p; i <= n; i += p) {\n                is_prime[i] = false;\n            }\n        }\n    }\n}",
    "expected_tc": "O(n log log n)",
    "expected_sc": "O(n)",
    "expected_algorithms": [
      "Sieve"
    ],
    "tags": [
      "sieve",
      "math"
    ]
  },
  {
    "id": "sieve_java",
    "name": "Sieve of Eratosthenes (Java)",
    "language": "java",
    "code": "class Solution {\n    public void sieve(int n) {\n        boolean[] isPrime = new boolean[n + 1];\n        for (int i = 2; i <= n; i++) isPrime[i] = true;\n        for (int p = 2; p * p <= n; p++) {\n            if (isPrime[p]) {\n                for (int i = p * p; i <= n; i += p) {\n                    isPrime[i] = false;\n                }\n            }\n        }\n    }\n}",
    "expected_tc": "O(n log log n)",
    "expected_sc": "O(n)",
    "expected_algorithms": [
      "Sieve"
    ],
    "tags": [
      "sieve",
      "math"
    ]
  },
  {
    "id": "dfs_graph_cpp",
    "name": "Graph DFS traversal (C++)",
    "language": "cpp",
    "code": "void dfs(int u, vector<bool>& vis, const vector<vector<int>>& g) {\n    vis[u] = true;\n    for (int v : g[u]) {\n        if (!vis[v]) {\n            dfs(v, vis, g);\n        }\n    }\n}",
    "expected_tc": "O(V + E)",
    "expected_sc": "O(V + E)",
    "expected_algorithms": [
      "DFS"
    ],
    "tags": [
      "graph",
      "dfs"
    ]
  },
  {
    "id": "dfs_graph_java",
    "name": "Graph DFS traversal (Java)",
    "language": "java",
    "code": "class Solution {\n    public void dfs(int u, boolean[] vis, java.util.List<java.util.List<Integer>> g) {\n        vis[u] = true;\n        for (int v : g.get(u)) {\n            if (!vis[v]) {\n                dfs(v, vis, g);\n            }\n        }\n    }\n}",
    "expected_tc": "O(V + E)",